Task,Category,Priority
Complete online course by tomorrow,Study,Medium
Take notes for geography project immediately,Study,High
Research sprint plan today,Work,Medium
Draft sprint plan by tomorrow,Work,Medium
Pay weekly groceries by tomorrow,Personal,Medium
Present project report today,Work,Medium
Research bug in production by tomorrow,Work,High
Solve thesis introduction as soon as possible,Study,Medium
Review marketing strategy for next week,Work,Medium
Study machine learning tutorial immediately,Study,High
Watch garden plants for next week,Personal,Low
Memorize psychology notes immediately,Study,High
Study machine learning tutorial as soon as possible,Study,Medium
Clean car,Personal,Low
Analyze sprint plan for next week,Work,Medium
Take notes for physics numericals today,Study,Medium
Plan weekend trip as soon as possible,Personal,Low
Write math assignment,Study,Medium
Schedule team meeting immediately,Work,High
Plan car,Personal,Medium
Clean football with friends today,Personal,Low
Develop team meeting immediately,Work,High
Develop office workstation today,Work,Medium
Complete server maintenance today,Work,Medium
Visit weekend trip by tomorrow,Personal,Low
Present team meeting,Work,High
Review business lead as soon as possible,Work,Medium
Solve geography project for next week,Study,Medium
Schedule bug in production immediately,Work,High
Buy living room for next week,Personal,Medium
Fix code documentation immediately,Work,High
Pay car immediately,Personal,High
Take notes for physics numericals,Study,Medium
Submit software feature for next week,Work,High
Attend software feature by tomorrow,Work,Medium
Solve psychology notes by tomorrow,Study,Medium
Coordinate sprint plan today,Work,Medium
Listen to gym workout immediately,Personal,High
Write biology chapter immediately,Study,High
Go to garden plants,Personal,Medium
Listen to dentist appointment by tomorrow,Personal,Medium
Water garden plants by tomorrow,Personal,Medium
Watch English vocabulary today,Study,Low
Review server maintenance by tomorrow,Work,Medium
Email code documentation immediately,Work,High
Call client proposal today,Work,Medium
Fix sprint plan today,Work,Medium
Coordinate code documentation,Work,Medium
Solve final exam,Study,High
Practice psychology notes today,Study,Medium
Study online course as soon as possible,Study,Medium
Submit team meeting today,Work,High
Buy healthy dinner for next week,Personal,Medium
Email office workstation as soon as possible,Work,Medium
Research marketing strategy,Work,Medium
Visit electricity bill by tomorrow,Personal,High
Coordinate bug in production today,Work,High
Visit yoga session for next week,Personal,Medium
Organize weekly groceries today,Personal,Medium
Water favorite podcast by tomorrow,Personal,Low
Submit geography project immediately,Study,High
Develop marketing strategy as soon as possible,Work,Medium
Draft quarterly sales data by tomorrow,Work,Medium
Revise biology chapter for next week,Study,Medium
Research software feature as soon as possible,Work,Medium
Solve history essay for next week,Study,Medium
Research online course today,Study,Medium
Submit history essay immediately,Study,High
Watch final exam as soon as possible,Study,High
Write university library books by tomorrow,Study,Medium
Email office workstation immediately,Work,High
Revise machine learning tutorial as soon as possible,Study,Medium
Listen to favorite podcast by tomorrow,Personal,Low
Prepare online course by tomorrow,Study,Medium
Submit physics numericals,Study,High
Watch geography project for next week,Study,Low
Schedule quarterly sales data by tomorrow,Work,Medium
Present sprint plan for next week,Work,Medium
Visit dentist appointment,Personal,Medium
Research quarterly sales data for next week,Work,Medium
Pay healthy dinner as soon as possible,Personal,Medium
Draft software feature as soon as possible,Work,Medium
Update business lead by tomorrow,Work,Medium
Complete sprint plan today,Work,Medium
Coordinate marketing strategy immediately,Work,High
Practice biology chapter by tomorrow,Study,Medium
Organize team meeting,Work,High
Solve psychology notes today,Study,Medium
Exercise favorite podcast by tomorrow,Personal,Low
Pay favorite podcast for next week,Personal,Low
Read physics numericals today,Study,Medium
Watch living room immediately,Personal,High
Submit coding challenge immediately,Study,High
Watch garden plants immediately,Personal,High
Call marketing strategy,Work,Medium
Research final exam as soon as possible,Study,High
Coordinate code documentation immediately,Work,High
Develop marketing strategy by tomorrow,Work,Medium
Watch university library books as soon as possible,Study,Low
Present quarterly sales data today,Work,Medium
Research client proposal by tomorrow,Work,Medium
Write final exam,Study,High
Practice thesis introduction by tomorrow,Study,Medium
Research contract for freelancer immediately,Work,High
Analyze bug in production by tomorrow,Work,High
Write English vocabulary,Study,Medium
Read online course,Study,Medium
Write thesis introduction,Study,Medium
Take notes for university library books today,Study,Medium
Go to wardrobe today,Personal,Medium
Submit math assignment immediately,Study,High
Develop business lead today,Work,Medium
Watch dentist appointment by tomorrow,Personal,Low
Complete budget sheet,Work,Medium
Water weekend trip as soon as possible,Personal,Low
Email server maintenance immediately,Work,High
Clean wardrobe immediately,Personal,High
Exercise weekly groceries by tomorrow,Personal,Medium
Memorize geography project for next week,Study,Medium
Develop client proposal for next week,Work,Medium
Practice history essay for next week,Study,Medium
Call LinkedIn profile today,Work,Medium
Pay healthy dinner for next week,Personal,Medium
Visit gym workout as soon as possible,Personal,Medium
Present server maintenance immediately,Work,High
Submit business lead,Work,High
Pay dancing class immediately,Personal,High
Update LinkedIn profile,Work,Medium
Wash football with friends immediately,Personal,High
Analyze server maintenance by tomorrow,Work,Medium
Schedule team meeting as soon as possible,Work,High
Fix bug in production as soon as possible,Work,High
Play Netflix movie by tomorrow,Personal,Low
Water favorite podcast today,Personal,Low
Go to weekend trip as soon as possible,Personal,Low
Revise math assignment for next week,Study,Medium
Memorize math assignment by tomorrow,Study,Medium
Submit history essay for next week,Study,High
Watch car for next week,Personal,Low
Buy weekend trip immediately,Personal,High
Complete budget sheet for next week,Work,Medium
Review LinkedIn profile immediately,Work,High
Write English vocabulary for next week,Study,Medium
Complete online course today,Study,Medium
Call software feature immediately,Work,High
Coordinate business lead immediately,Work,High
Fix contract for freelancer by tomorrow,Work,Medium
Attend electricity bill as soon as possible,Personal,High
Practice geography project for next week,Study,Medium
Exercise car immediately,Personal,High
Listen to weekend trip,Personal,Low
Analyze quarterly sales data by tomorrow,Work,Medium
Attend weekly groceries by tomorrow,Personal,Medium
Call LinkedIn profile immediately,Work,High
Pay dancing class by tomorrow,Personal,Low
Visit gym workout today,Personal,Medium
Complete coding challenge for next week,Study,Medium
Wash Netflix movie for next week,Personal,Low
Organize quarterly sales data as soon as possible,Work,Medium
Complete server maintenance for next week,Work,Medium
Fix budget sheet today,Work,Medium
Watch electricity bill for next week,Personal,High
Take notes for English vocabulary as soon as possible,Study,Medium
Develop LinkedIn profile by tomorrow,Work,Medium
Buy wardrobe as soon as possible,Personal,Medium
Plan garden plants by tomorrow,Personal,Medium
Clean garden plants by tomorrow,Personal,Low
Call marketing strategy as soon as possible,Work,Medium
Watch English vocabulary,Study,Low
Analyze budget sheet as soon as possible,Work,Medium
Take notes for history essay by tomorrow,Study,Medium
Take notes for chemistry lab report immediately,Study,High
Research sprint plan immediately,Work,High
Buy car by tomorrow,Personal,Medium
Complete bug in production today,Work,High
Schedule budget sheet today,Work,Medium
Cook healthy dinner for next week,Personal,Medium
Listen to garden plants immediately,Personal,High
Wash favorite podcast today,Personal,Low
Listen to garden plants by tomorrow,Personal,Medium
Play electricity bill immediately,Personal,High
Organize dancing class as soon as possible,Personal,Low
Read machine learning tutorial today,Study,Medium
Call business lead immediately,Work,High
Exercise weekly groceries today,Personal,Medium
Study math assignment as soon as possible,Study,Medium
Exercise yoga session,Personal,Medium
Present bug in production by tomorrow,Work,High
Attend dancing class immediately,Personal,High
Call sprint plan by tomorrow,Work,Medium
Wash weekend trip for next week,Personal,Low
Practice university library books immediately,Study,High
Update marketing strategy immediately,Work,High
Update office workstation by tomorrow,Work,Medium
Plan favorite podcast as soon as possible,Personal,Low
Schedule team meeting today,Work,High
Listen to living room immediately,Personal,High
Pay weekly groceries today,Personal,Medium
Take notes for math assignment for next week,Study,Medium
Write English vocabulary as soon as possible,Study,Medium
Develop budget sheet for next week,Work,Medium
Play favorite podcast immediately,Personal,High
Schedule bug in production today,Work,High
Attend favorite podcast immediately,Personal,High
Solve thesis introduction by tomorrow,Study,Medium
Water weekly groceries as soon as possible,Personal,Medium
Attend yoga session as soon as possible,Personal,Medium
Practice online course as soon as possible,Study,Medium
Take notes for biology chapter immediately,Study,High
Fix sprint plan,Work,Medium
Read biology chapter today,Study,Medium
Complete contract for freelancer for next week,Work,Medium
Organize code documentation for next week,Work,Medium
Exercise healthy dinner for next week,Personal,Medium
Prepare machine learning tutorial immediately,Study,High
Study thesis introduction today,Study,Medium
Watch living room by tomorrow,Personal,Low
Call budget sheet today,Work,Medium
Submit server maintenance by tomorrow,Work,High
Play wardrobe immediately,Personal,High
Watch geography project today,Study,Low
Email project report for next week,Work,Medium
Update code documentation immediately,Work,High
Research history essay,Study,Medium
Draft team meeting as soon as possible,Work,High
Prepare psychology notes today,Study,Medium
Take notes for chemistry lab report for next week,Study,Medium
Watch wardrobe immediately,Personal,High
Practice university library books as soon as possible,Study,Medium
Watch university library books,Study,Low
Study biology chapter for next week,Study,Medium
Fix quarterly sales data for next week,Work,Medium
Email contract for freelancer for next week,Work,Medium
Exercise football with friends by tomorrow,Personal,Low
Clean Netflix movie for next week,Personal,Low
Complete LinkedIn profile by tomorrow,Work,Medium
Wash weekly groceries for next week,Personal,Medium
Submit university library books today,Study,High
Watch psychology notes as soon as possible,Study,Low
Submit psychology notes immediately,Study,High
Watch healthy dinner by tomorrow,Personal,Low
Develop sprint plan as soon as possible,Work,Medium
Take notes for coding challenge,Study,Medium
Submit LinkedIn profile today,Work,High
Read physics numericals as soon as possible,Study,Medium
Complete software feature for next week,Work,Medium
Wash dancing class,Personal,Low
Listen to electricity bill as soon as possible,Personal,High
Update marketing strategy by tomorrow,Work,Medium
Email project report by tomorrow,Work,Medium
Revise physics numericals,Study,Medium
Study geography project immediately,Study,High
Organize contract for freelancer as soon as possible,Work,Medium
Research marketing strategy immediately,Work,High
Draft sprint plan for next week,Work,Medium
Email code documentation,Work,Medium
Complete budget sheet as soon as possible,Work,Medium
Organize garden plants,Personal,Medium
Draft team meeting today,Work,High
Memorize history essay for next week,Study,Medium
Prepare math assignment immediately,Study,High
Watch final exam for next week,Study,High
Email contract for freelancer immediately,Work,High
Present office workstation for next week,Work,Medium
Attend sprint plan today,Work,Medium
Attend client proposal by tomorrow,Work,Medium
Clean weekly groceries as soon as possible,Personal,Low
Call client proposal,Work,Medium
Develop contract for freelancer today,Work,Medium
Complete English vocabulary,Study,Medium
Attend English vocabulary by tomorrow,Study,Medium
Research history essay immediately,Study,High
Take notes for university library books,Study,Medium
Draft LinkedIn profile for next week,Work,Medium
Take notes for history essay for next week,Study,Medium
Develop budget sheet immediately,Work,High
Play gym workout today,Personal,Medium
Email business lead immediately,Work,High
Water weekend trip,Personal,Low
Call quarterly sales data today,Work,Medium
Practice online course,Study,Medium
Research team meeting for next week,Work,High
Attend English vocabulary today,Study,Medium
Review LinkedIn profile as soon as possible,Work,Medium
Call code documentation,Work,Medium
Pay living room,Personal,Medium
Attend football with friends for next week,Personal,Low
Attend contract for freelancer for next week,Work,Medium
Watch car as soon as possible,Personal,Low
Play car by tomorrow,Personal,Medium
Attend contract for freelancer,Work,Medium
Schedule quarterly sales data today,Work,Medium
Practice geography project today,Study,Medium
Complete chemistry lab report by tomorrow,Study,Medium
Submit English vocabulary for next week,Study,High
Attend weekly groceries,Personal,Medium
Pay car as soon as possible,Personal,Medium
Attend university library books as soon as possible,Study,Medium
Attend office workstation for next week,Work,Medium
Submit final exam by tomorrow,Study,High
Fix team meeting as soon as possible,Work,High
Draft LinkedIn profile by tomorrow,Work,Medium
Fix client proposal,Work,Medium
Coordinate sprint plan as soon as possible,Work,Medium
Email software feature,Work,Medium
Research psychology notes for next week,Study,Medium
Take notes for geography project as soon as possible,Study,Medium
Submit office workstation by tomorrow,Work,High
Watch football with friends immediately,Personal,High
Exercise weekly groceries,Personal,Medium
Complete biology chapter as soon as possible,Study,Medium
Plan electricity bill by tomorrow,Personal,High
Schedule software feature today,Work,Medium
Study history essay by tomorrow,Study,Medium
Fix marketing strategy for next week,Work,Medium
Schedule server maintenance immediately,Work,High
Take notes for machine learning tutorial,Study,Medium
Pay wardrobe today,Personal,Medium
Update bug in production today,Work,High
Coordinate LinkedIn profile immediately,Work,High
Go to gym workout immediately,Personal,High
Call bug in production for next week,Work,High
Organize football with friends immediately,Personal,High
Attend geography project as soon as possible,Study,Medium
Complete geography project,Study,Medium
Read math assignment,Study,Medium
Wash electricity bill by tomorrow,Personal,High
Cook yoga session as soon as possible,Personal,Medium
Watch final exam today,Study,High
Develop code documentation,Work,Medium
Watch electricity bill today,Personal,High
Water healthy dinner for next week,Personal,Medium
Complete project report by tomorrow,Work,Medium
Prepare chemistry lab report as soon as possible,Study,Medium
Fix LinkedIn profile,Work,Medium
Attend math assignment immediately,Study,High
Read biology chapter for next week,Study,Medium
Memorize coding challenge today,Study,Medium
Organize server maintenance today,Work,Medium
Fix client proposal by tomorrow,Work,Medium
Complete final exam,Study,High
Develop contract for freelancer,Work,Medium
Present budget sheet for next week,Work,Medium
Revise coding challenge as soon as possible,Study,Medium
Develop team meeting by tomorrow,Work,High
Attend gym workout today,Personal,Medium
Buy Netflix movie by tomorrow,Personal,Low
Go to yoga session for next week,Personal,Medium
Develop sprint plan for next week,Work,Medium
Fix office workstation,Work,Medium
Review contract for freelancer for next week,Work,Medium
Play Netflix movie today,Personal,Low
Practice history essay,Study,Medium
Write psychology notes by tomorrow,Study,Medium
Analyze team meeting as soon as possible,Work,High
Organize client proposal for next week,Work,Medium
Read biology chapter as soon as possible,Study,Medium
Complete machine learning tutorial as soon as possible,Study,Medium
Schedule LinkedIn profile immediately,Work,High
Draft budget sheet,Work,Medium
Buy football with friends as soon as possible,Personal,Low
Submit project report today,Work,High
Watch yoga session today,Personal,Low
Take notes for coding challenge by tomorrow,Study,Medium
Study chemistry lab report by tomorrow,Study,Medium
Organize car as soon as possible,Personal,Medium
Practice coding challenge today,Study,Medium
Listen to yoga session as soon as possible,Personal,Medium
Attend business lead today,Work,Medium
Call quarterly sales data for next week,Work,Medium
Attend marketing strategy by tomorrow,Work,Medium
Buy wardrobe by tomorrow,Personal,Medium
Complete psychology notes immediately,Study,High
Read thesis introduction,Study,Medium
Listen to electricity bill by tomorrow,Personal,High
Revise thesis introduction,Study,Medium
Attend favorite podcast for next week,Personal,Low
Buy wardrobe immediately,Personal,High
Email client proposal by tomorrow,Work,Medium
Visit football with friends today,Personal,Low
Research LinkedIn profile immediately,Work,High
Clean garden plants as soon as possible,Personal,Low
Practice physics numericals today,Study,Medium
Practice chemistry lab report by tomorrow,Study,Medium
Go to dancing class for next week,Personal,Low
Clean favorite podcast,Personal,Low
Analyze business lead,Work,Medium
Analyze bug in production today,Work,High
Water weekly groceries today,Personal,Medium
Wash living room immediately,Personal,High
Write chemistry lab report,Study,Medium
Coordinate bug in production,Work,High
Pay weekend trip for next week,Personal,Low
Memorize biology chapter as soon as possible,Study,Medium
Schedule project report as soon as possible,Work,Medium
Attend English vocabulary,Study,Medium
Review sprint plan as soon as possible,Work,Medium
Develop business lead,Work,Medium
Listen to yoga session today,Personal,Medium
Water Netflix movie immediately,Personal,High
Prepare machine learning tutorial,Study,Medium
Watch history essay as soon as possible,Study,Low
Draft code documentation,Work,Medium
Memorize university library books immediately,Study,High
Exercise weekend trip as soon as possible,Personal,Low
Prepare coding challenge by tomorrow,Study,Medium
Study chemistry lab report for next week,Study,Medium
Complete final exam today,Study,High
Read geography project by tomorrow,Study,Medium
Wash gym workout,Personal,Medium
Take notes for biology chapter as soon as possible,Study,Medium
Prepare geography project immediately,Study,High
Go to living room for next week,Personal,Medium
Listen to garden plants today,Personal,Medium
Develop software feature today,Work,Medium
Submit software feature by tomorrow,Work,High
Clean Netflix movie as soon as possible,Personal,Low
Develop team meeting,Work,High
Buy garden plants today,Personal,Medium
Go to favorite podcast today,Personal,Low
Memorize chemistry lab report today,Study,Medium
Complete coding challenge by tomorrow,Study,Medium
Fix bug in production for next week,Work,High
Fix quarterly sales data,Work,Medium
Organize favorite podcast as soon as possible,Personal,Low
Attend football with friends,Personal,Low
Research online course as soon as possible,Study,Medium
Attend psychology notes as soon as possible,Study,Medium
Organize favorite podcast today,Personal,Low
Wash electricity bill as soon as possible,Personal,High
Schedule business lead as soon as possible,Work,Medium
Listen to healthy dinner immediately,Personal,High
Attend thesis introduction by tomorrow,Study,Medium
Review server maintenance for next week,Work,Medium
Complete geography project as soon as possible,Study,Medium
Solve psychology notes,Study,Medium
Take notes for thesis introduction today,Study,Medium
Analyze office workstation for next week,Work,Medium
Complete project report as soon as possible,Work,Medium
Plan healthy dinner,Personal,Medium
Complete final exam by tomorrow,Study,High
Take notes for university library books by tomorrow,Study,Medium
Fix marketing strategy by tomorrow,Work,Medium
Plan weekend trip by tomorrow,Personal,Low
Watch football with friends today,Personal,Low
Update business lead today,Work,Medium
Pay weekend trip today,Personal,Low
Cook Netflix movie immediately,Personal,High
Review business lead,Work,Medium
Organize Netflix movie today,Personal,Low
Present server maintenance by tomorrow,Work,Medium
Buy weekend trip as soon as possible,Personal,Low
Coordinate project report as soon as possible,Work,Medium
Coordinate client proposal immediately,Work,High
Buy car for next week,Personal,Medium
Organize football with friends,Personal,Low
Call contract for freelancer for next week,Work,Medium
Plan dancing class for next week,Personal,Low
Practice online course today,Study,Medium
Coordinate project report,Work,Medium
Cook football with friends today,Personal,Low
Analyze business lead immediately,Work,High
Memorize coding challenge immediately,Study,High
Fix quarterly sales data today,Work,Medium
Submit quarterly sales data by tomorrow,Work,High
Organize favorite podcast for next week,Personal,Low
Prepare physics numericals today,Study,Medium
Buy garden plants as soon as possible,Personal,Medium
Practice machine learning tutorial as soon as possible,Study,Medium
Schedule sprint plan today,Work,Medium
Revise coding challenge immediately,Study,High
Water car by tomorrow,Personal,Medium
Review software feature immediately,Work,High
Play dancing class immediately,Personal,High
Complete machine learning tutorial for next week,Study,Medium
Plan football with friends immediately,Personal,High
Submit biology chapter as soon as possible,Study,High
Submit client proposal for next week,Work,High
Present team meeting immediately,Work,High
Submit bug in production today,Work,High
Call project report today,Work,Medium
Organize business lead immediately,Work,High
Update server maintenance by tomorrow,Work,Medium
Research team meeting today,Work,High
Watch weekly groceries for next week,Personal,Low
Visit favorite podcast for next week,Personal,Low
Clean healthy dinner by tomorrow,Personal,Low
Clean wardrobe today,Personal,Low
Watch dancing class today,Personal,Low
Buy Netflix movie,Personal,Low
Organize software feature today,Work,Medium
Complete coding challenge as soon as possible,Study,Medium
Wash healthy dinner for next week,Personal,Medium
Attend project report by tomorrow,Work,Medium
Prepare geography project as soon as possible,Study,Medium
Analyze business lead by tomorrow,Work,Medium
Plan living room,Personal,Medium
Research contract for freelancer for next week,Work,Medium
Coordinate budget sheet for next week,Work,Medium
Memorize university library books,Study,Medium
Complete team meeting today,Work,High
Take notes for chemistry lab report as soon as possible,Study,Medium
Fix business lead,Work,Medium
Cook weekly groceries today,Personal,Medium
Present contract for freelancer today,Work,Medium
Clean weekend trip,Personal,Low
Attend chemistry lab report today,Study,Medium
Complete code documentation as soon as possible,Work,Medium
Call code documentation by tomorrow,Work,Medium
Write coding challenge for next week,Study,Medium
Update LinkedIn profile today,Work,Medium
Attend electricity bill by tomorrow,Personal,High
Analyze LinkedIn profile for next week,Work,Medium
Research biology chapter as soon as possible,Study,Medium
Watch healthy dinner for next week,Personal,Low
Fix budget sheet immediately,Work,High
Write history essay for next week,Study,Medium
Attend university library books today,Study,Medium
Study online course by tomorrow,Study,Medium
Submit contract for freelancer,Work,High
Write thesis introduction today,Study,Medium
Complete physics numericals as soon as possible,Study,Medium
Plan yoga session as soon as possible,Personal,Medium
Update contract for freelancer immediately,Work,High
Write history essay today,Study,Medium
Develop budget sheet,Work,Medium
Exercise dancing class by tomorrow,Personal,Low
Revise coding challenge for next week,Study,Medium
Go to car by tomorrow,Personal,Medium
Submit bug in production for next week,Work,High
Study coding challenge immediately,Study,High
Fix LinkedIn profile as soon as possible,Work,Medium
Develop contract for freelancer for next week,Work,Medium
Study psychology notes today,Study,Medium
Clean gym workout by tomorrow,Personal,Low
Write math assignment for next week,Study,Medium
Organize bug in production immediately,Work,High
Complete university library books by tomorrow,Study,Medium
Review budget sheet for next week,Work,Medium
Take notes for physics numericals immediately,Study,High
Submit machine learning tutorial by tomorrow,Study,High
Complete sprint plan by tomorrow,Work,Medium
Revise physics numericals as soon as possible,Study,Medium
Attend project report,Work,Medium
Present software feature as soon as possible,Work,Medium
Research final exam for next week,Study,High
Submit thesis introduction,Study,High
Attend code documentation today,Work,Medium
Analyze client proposal today,Work,Medium
Clean favorite podcast today,Personal,Low
Call team meeting as soon as possible,Work,High
Review team meeting today,Work,High
